{
  "run_id": "run-01",
  "vm_id": "worker",
  "user_id": "user-01",
  "generation": "exec-01:7",
  "target": {
    "username": "user",
    "host": "10.77.0.2",
    "port": 22,
    "host_key_openssh": "ssh-ed25519 AAAAC3NzaC1lZDI1NTE5AAAAIFakeHostKeyForContractTestsOnly",
    "private_key_openssh": "-----BEGIN OPENSSH PRIVATE KEY-----\nfake-contract-fixture-only\n-----END OPENSSH PRIVATE KEY-----\n",
    "authorized_client_public_keys_openssh": [
      "ssh-ed25519 AAAAC3NzaC1lZDI1NTE5AAAAIFakeClientKeyForContractTestsOnly user@example"
    ]
  }
}
